"","prod_name","title","reviewer","review","date","ratings","type_of_purchase"
"1290","nejlsd-eyeliner-eyeshadow-blending-foundation","amazing brushes ","sean johnson","so good move over james charles sister bevoted out these brushes are very thing i wanted and more so easy to use and blending colors is easy so soft and easy to hold light and very use able perfection",2022-05-12,3,"verified purchase"
"1291","nejlsd-eyeliner-eyeshadow-blending-foundation","they are exactly the kind of quality you get when only paying  bucks","kale","some of the brushes were so smooshed together i couldnt use them",2023-12-04,4,"verified purchase"
"1292","nejlsd-eyeliner-eyeshadow-blending-foundation","these are great for beginners","miakate","wish it was a lil firm an they are good to use though",2022-02-05,5,"verified purchase"
"1293","nejlsd-eyeliner-eyeshadow-blending-foundation","worth it","sara hively","ive used these more then once  i live them so far i work from home so i just sit around doing my makeup  they are easy to use w different products  they really apply the makeup well",2021-03-13,3,"verified purchase"
"1294","nejlsd-eyeliner-eyeshadow-blending-foundation","good product","laceydawson","easy to use  simplifies makeup routine",2021-02-23,4,"verified purchase"
"1295","nejlsd-eyeliner-eyeshadow-blending-foundation","variety","breanna","angled brushes variety and worked very well",2021-02-19,4,"verified purchase"
"1296","nejlsd-eyeliner-eyeshadow-blending-foundation","the softness of the brush is amazing","gay","this was a great product for the price and its great for beginners you get a lot of",2021-05-23,5,"verified purchase"
"1297","nejlsd-eyeliner-eyeshadow-blending-foundation","great brushes fantastic value","dawn brooks","so many quality brushes of different sizes and with different tips these should last quite a while",2022-07-24,4,"verified purchase"
"1298","nejlsd-eyeliner-eyeshadow-blending-foundation","order these","della t","fantastic deal was leery because of the price but dont let that fool you perfectly soft and a beautiful set",2020-11-08,5,"verified purchase"
"1299","nejlsd-eyeliner-eyeshadow-blending-foundation","not that bad ","chillwig","good for if your traveling ",2021-12-18,4,"verified purchase"
"1300","nejlsd-eyeliner-eyeshadow-blending-foundation","great","amazon customer","great",2021-09-28,5,"verified purchase"
"1301","daybreak-loreal-paris-cosmetics-boosting","good product","bonnie cannings","this is a good product the colour is really pretty good highlighter",2022-11-22,3,"verified purchase"
"1302","daybreak-loreal-paris-cosmetics-boosting","so so","jecca","its a nice glow",2023-09-29,4,"verified purchase"
"1303","daybreak-loreal-paris-cosmetics-boosting","love it","nj","great little product very well skin balance for a beautiful awaken sexy glow",2022-01-19,3,"verified purchase"
"1304","daybreak-loreal-paris-cosmetics-boosting","very small","amazon customer","super smalltheres hardly any product in the bottle",2023-04-27,5,"verified purchase"
"1305","daybreak-loreal-paris-cosmetics-boosting","bad packaging","barbara","the product is exactly what i want  a lovely shimmering pink glow that highlights my cheeks and looks fresh has good staying power blends easily very pretty color subtle without disappearing the packaging is all wrong for this product the dropper is worse than worthless the product is too thick to extract with a dropper a brush sponge or squeeze bottle would have been much better im not going to return it because i love how it looks on my face but i wont buy more unless they change they packaging it is a small bottle and that would be okay if the packaging made sense but a lot of product is going to get wasted because the dropper doesnt work",2024-01-02,3,"verified purchase"
"1306","daybreak-loreal-paris-cosmetics-boosting","love the product","amazon customer","love the product",2021-03-30,3,"verified purchase"
"1307","daybreak-loreal-paris-cosmetics-boosting","pesimo no est nuevo","maddel yanire hernndez lpez","es un producto que viene usado y no te da opcin a rembolso",2023-04-10,4,"verified purchase"
"1308","daybreak-loreal-paris-cosmetics-boosting","con menos de los ml","maddel yanire hernndez lpez","el producto cumple su funcin pero tena la apariencia de haber sido abierto el producto se ve como si se hubiese separado un poco el color y el lquido pareca como si fuera agua por un lado y color por el otro  lo agite y funciono pero tuve qie hacerlo enrgicamente ya que la botella tena muy poco producto se que no es normal la cantidad porque ya haba comprado el producto el cual es buen producto  en una tienda departamental y la botellita se senta ms pesada yo espero haber tenido solo mala suerte porque el producto me encanta y por desgracia en la tienda ya no he encontrado ese tono no se si me arriesgare al comprarlo por segunda ocasin",2018-11-20,1,"verified purchase"
"1309","daybreak-loreal-paris-cosmetics-boosting","super glowy","cliente de amazon","good",2023-01-21,1,"verified purchase"
"1310","daybreak-loreal-paris-cosmetics-boosting","smooth application great value","chahat","this is my favorite glow lotion  it has just the right amount of glow without looking like glitter  very smooth application and excellent value",2023-10-24,1,"verified purchase"
"1311","daybreak-loreal-paris-cosmetics-boosting","trs reluisant","micheline arsenault","un peu inutile autre que si vous voulez un look brillant  combiner avec un fond de teint ",2023-09-07,3,"verified purchase"
"1312","daybreak-loreal-paris-cosmetics-boosting","dont buy","victoria banos","it was terrible does not work very clumpy dont blend well",2022-09-06,2,"verified purchase"
"1313","daybreak-loreal-paris-cosmetics-boosting","viene manchado","b","no se si este usado o que pero viene manchado",2022-09-18,1,"verified purchase"
"1314","daybreak-loreal-paris-cosmetics-boosting","kinda crappy","b","love this brand and the lumi glow line but this product fell short it does not suck up in the pipette at all you just have to like scoop it out with pipette and it has much more of a redblush tone than pictured im very fair and was expecting a very light colored more liquidy lightweight glow drop from this but it is very thick will not order again",2023-07-08,1,"verified purchase"
"1315","daybreak-loreal-paris-cosmetics-boosting","awesome","sierra","is perfect i was worried it be too dark but you only need a drop to mix with you foundation or bb cream and it gives you the shine and glow",2020-09-18,1,"verified purchase"
"1316","daybreak-loreal-paris-cosmetics-boosting","half full","goju","like the product but received it only half full it mixes nicely with my foundation giving my skin a lovely fresh glow",2019-12-01,2,"verified purchase"
"1317","daybreak-loreal-paris-cosmetics-boosting","did not receive full order","beautiful italian girl","still did not receive missing second bottle of order",2022-07-30,5,"verified purchase"
"1318","daybreak-loreal-paris-cosmetics-boosting","toujours satisfaite de l oreal","daniel gabbamonte","un mariagetres bon produit",2022-10-10,2,"verified purchase"
"1319","daybreak-loreal-paris-cosmetics-boosting","pretty and glowy","lyne","i bought this product to add to my foundation before application i dont have to use much it really adds a nice glow to my foundation",2023-09-14,3,"verified purchase"
"1320","daybreak-loreal-paris-cosmetics-boosting","fast delivery  as described","s kessler","super fast delivery and as described  thank you",2020-08-01,5,"verified purchase"
"1321","daybreak-loreal-paris-cosmetics-boosting","vena abierto y a la mitad","natalia vargas","vena abierto y estaba a la mitad",2020-02-08,3,"verified purchase"
"1322","daybreak-loreal-paris-cosmetics-boosting","subtle sparkle","amazon customer","really pretty highlight bronze with a subtle hint of sparkle  should have returned it though because the bottle was practically empty as if it was already used",2024-01-27,1,"verified purchase"
"1323","daybreak-loreal-paris-cosmetics-boosting","not a natural glow look","kez","i was expecting the texture to be more oily a little more like mon amour loreal which is no longer available anymore so when i tried this one i was kind of disappointed cause this one is to shiny but looks like a fake powder shine not a natural glow like the mon amour  but thats my opinion maybe someone would love it",2023-11-08,3,"verified purchase"
"1324","daybreak-loreal-paris-cosmetics-boosting","descarapela mi piel","no me gust del todo ya que hace que mi cara de descarapele","suelo humectarme bien mi piel me puse esto para que brillara pero se descarapelo",2023-11-03,3,"verified purchase"
"1325","daybreak-loreal-paris-cosmetics-boosting","ok","emely","i thought it was bronzing drops at first i wanted to do it for drunk elephant if youre looking for a dupe its not this one",2023-09-30,3,"verified purchase"
"1326","daybreak-loreal-paris-cosmetics-boosting","color performs as indicated","veda swoap","this color is very light shouldve ordered a deeper shade",2023-09-13,3,"verified purchase"
"1327","daybreak-loreal-paris-cosmetics-boosting","really really shimmery","carrin","first of all everyone is right when they say the dropper doesnt work its easy enough to just scrape product of the side of the dropper but stilli wanted just a little tint to add to my moisturizer this has makeup like coverage and is really shimmery useable but not what i wanted",2023-07-20,4,"verified purchase"
"1328","daybreak-loreal-paris-cosmetics-boosting","un poco ms luminoso de lo esperado","catalina borda","pens que funcionara como la crema pero parece ms un iluminador de maquillaje me gusta pero no me encanta",2023-05-22,3,"verified purchase"
"1329","daybreak-loreal-paris-cosmetics-boosting","globby and not easy to use","amanda rodriguez","this product comes out thick and globby and is way too shiny for my taste i was thinking it would be a thinner product that would be easier to work with",2023-07-04,4,"verified purchase"
"1330","daybreak-loreal-paris-cosmetics-boosting","to thick","debera","these drops to thick for their dropper have to use a q tip to get out of jar causing a lot of waste of the product they do illuminate skin beautifully",2023-06-23,3,"verified purchase"
"1331","daybreak-loreal-paris-cosmetics-boosting","beautiful glow if you use it as intended","amarie","this is not a highlighter so those that are trying to use it as such will be disappointed  it isnt even marketed as a highlighter  it is to mix in with your foundation concealer or other makeup to add a subtle glow  i love the look of this in daybreak  its definitely a glow and not a glitter  its a very beautiful look for those who want a dewy look  for reference i have very fair skin  my only complaint is that it is thick and the dropper is not the best delivery method  it should be in a tube and loral needs to address this and redo the packaging  i took one star off for this reason  i have priced other products like this and this is by far the most economical  all other products have near the same amount of ounces for double and triple the price  this was an excellent find",2018-04-26,3,"verified purchase"
"1332","daybreak-loreal-paris-cosmetics-boosting","great colorno so great dropper","jami","love the color but the dropper doesnt really work well its hard to get it out of bottle would buy again if it was easier to dispense product",2023-06-13,4,"verified purchase"
"1333","daybreak-loreal-paris-cosmetics-boosting","its okay very sparkly","hayleab","its pretty but not really what i expectedi thought it was to put underneath or mix in with foundation to give you a dewy glossy luminating look but its just really sparkly and pink  i also thought it would be more watery and easy to drop but its really thick and hard to get out of the dropper it reminds me of nail polish",2019-12-20,3,"verified purchase"
"1334","daybreak-loreal-paris-cosmetics-boosting","i like it","hayleab","this product is so pretty and leaves you with a perfect glow but it is super tiny especially for  when it arrived it was only half full and the seller refused to do anything about it",2023-03-30,3,"verified purchase"
"1335","daybreak-loreal-paris-cosmetics-boosting","its okay","aubrie burclaw","its okay not very pigmented buy it if you want a very small minimal glow like very minimal",2021-07-05,3,"verified purchase"
"1336","daybreak-loreal-paris-cosmetics-boosting","on the fence","roselinn","a little goes a long way you maybe need a tiny drop mixed in with your foundation for this to do its job which is good because it will last me awhile and i wont run out of it quickly i will say though that for the price for a drug store product the bottle was a lot small than i thought it was going to be and the bottle seemed to only be like half way filled with product so that was a little disappointing but i do enjoy it",2022-05-20,3,"verified purchase"
"1337","daybreak-loreal-paris-cosmetics-boosting","mo","amazon customer","didnt like too wet",2023-07-19,3,"verified purchase"
"1338","daybreak-loreal-paris-cosmetics-boosting","not great but decent","angela smith","this is quite small i expected it to be larger it is also very clumpy and theres no point in having the dropper feature because the formula is so thick that the formula will not come out of the dropper i added water to the formula which helped a lot and the dropper is now useful",2023-01-07,3,"verified purchase"
"1339","daybreak-loreal-paris-cosmetics-boosting","odd","stella wilson","packaging is sketchy white bulb on dropper is weirdly dirty as other reviews have stated the safety seal was just  small piece of tape along the twist part of dropper it is super thick and clumpy wondering if its old or something not really suitable for a dropper i feel like if you just purchase the product from your local drugstore its probably decent thats where ill purchase from next time",2022-08-04,3,"verified purchase"
"1340","daybreak-loreal-paris-cosmetics-boosting","looks lovely glides on smooth sadly makes me breakout","ulsrud","as the title says i was pleased with the look and feel of this but after using it for a while i noticed i started breaking out on my cheeks which is very abnormal for me i discontinued using it and the breakouts stopped unfortunately i will not be able to continue using this product",2022-12-14,3,"verified purchase"
"1341","daybreak-loreal-paris-cosmetics-boosting","idk","lamita","dosent rly show up and leaves a mess on ur hands if ur using ur hands to blend it also smells like caca",2021-02-09,3,"verified purchase"
"1342","daybreak-loreal-paris-cosmetics-boosting","love but hate","ryann taylor","i love this but the packaging sucks i feel like i get  very little use out of it",2023-05-01,3,"verified purchase"
"1343","daybreak-loreal-paris-cosmetics-boosting","why send an open bottle","cindy","this product was open not happy",2021-07-13,3,"verified purchase"
"1344","daybreak-loreal-paris-cosmetics-boosting","me gust mucho","amayu","the media could not be loaded                                                                        me gust mucho el acabadoalgo que no me gust es que viene en forma de gotero como de srum pens que era como de esponjita el colocador de producto",2023-09-11,3,"verified purchase"
"1345","daybreak-loreal-paris-cosmetics-boosting","love it","curlykay","i bought the daybreak shade and just love it  i want to try golden hour now  i was surprised by how thick it is and the dropper doesnt quite work as one would expect but a single dab shared between my palms which i spread over my face with both hands is all i need for a subtle shine  very pleased with the results",2019-12-13,5,"verified purchase"
"1346","daybreak-loreal-paris-cosmetics-boosting","gorgeous but does not last long","grace robinson","it was smaller than expected and the dropper is kind of crappy but it looks great on the skin less is more because it is very shinny and illuminating",2022-11-19,5,"verified purchase"
"1347","daybreak-loreal-paris-cosmetics-boosting","pretty good for price","nina","more like a highlighter i put it all over my face and i looked glittery",2023-04-11,4,"verified purchase"
"1348","daybreak-loreal-paris-cosmetics-boosting","good but  very thick","kara green","its nice and small but its really thick so the dropper doesnt work well",2023-01-09,3,"verified purchase"
"1349","daybreak-loreal-paris-cosmetics-boosting","trs bien","yub","perfect",2021-08-03,4,"verified purchase"
"1350","daybreak-loreal-paris-cosmetics-boosting","not bad","gus b","its not bad small bottle it is a dark gold so if you have very fair skin you might want to go lighter",2020-04-13,4,"verified purchase"
"1351","nyx-professional-makeup-peekaboo-neutral","great lip liner for the price","ri","so this lip liner is the matte dryer waxy kind not the type that glides and feels moisturizing however i personally prefer this type as i find they last longer and look the most realistic if you like to subtly overline the shade peekaboo neutral is for you if you have naturally lightmedium true pink lips or want it to match a lipstick in that range it will be the perfect slight overline shade does not have a coolgrey undertone if you prefer that try the shade natural its a bit deeper and slightly more neutral rather than pink nude pink is significantly lighterbrighter pink than both peekaboo and natural it would be best for lips that are naturally quite a lightbrighter pink i adore this lip liner for the price especially",2024-01-23,4,"verified purchase"
"1352","nyx-professional-makeup-peekaboo-neutral","great one","diana f emmert","i love a nude color lip pencil as you can wear almost any color of lipstick with it this one glides on smoothly and stays highly recommended",2024-02-16,5,"verified purchase"
"1353","nyx-professional-makeup-peekaboo-neutral","no me gust","lore i","no tiene buena pigmentacin y es duro por lo que corre bien sobre los labios y hay que remarcar mucho el color es claro pero es algo que buscaba",2023-03-22,5,"verified purchase"
"1354","nyx-professional-makeup-peekaboo-neutral","lip liner","betzy","i order this thinking it was going to be one individual lip liner  so i order  of them thinking it was individual but it comes in  so if u was to order a lip liner youll get  of them  also i order the coffe lip liner because i had nyx lip line shade coffe that i bought at the store but now i cant find it in stores so i seen it on amazon and bought it but when i compared them it looked nothing alike  thats just me tho i love it overall",2024-02-01,3,"verified purchase"
"1355","nyx-professional-makeup-peekaboo-neutral","great but not my favorite","etta t","this is great and so affordable which is one reason i bought it i currently can not afford my favorite which is the buxom lip liners so i opted for this its very hard but it is long lasting and easy to sharpen i havent had any issues with breakage",2024-02-15,4,"verified purchase"
"1356","nyx-professional-makeup-peekaboo-neutral","longest lasting color i have bought from nyx","friendofafreind","this color ever gives me a tint similar to benetint but with the precision of a liner its the longest lasting color i have tried from nyx the nudes are pretty colors but disappear so quickly i just throw some balm over it to go the gym and i feel put together for the price you cant beat it",2024-02-17,4,"verified purchase"
"1357","nyx-professional-makeup-peekaboo-neutral","perfect","noehive","i bought this as a gift for my friend and they loved it it was packaged pretty nicely so no signs of opened plastic or broken parts  good so far and the color was just what i expected",2024-02-23,5,"verified purchase"
"1358","nyx-professional-makeup-peekaboo-neutral","cutest pink color","lauren linn","i alwayss get compliments when i wear this lip liner  its a fav xx makes me look like barbie",2024-02-18,5,"verified purchase"
"1359","nyx-professional-makeup-peekaboo-neutral","nice color and texture","m c","nice color and texture but i was disappointed that it couldnt be sharpened",2024-02-20,4,"verified purchase"
"1360","nyx-professional-makeup-peekaboo-neutral","perfect nude for fair skin","nicd","as someone with very fair skin with pink undertones nicole kidmanish its difficult to find a decent nude lip liner because most are too dark or seem to have a peachy tone that just doesnt work with my complexion however  pale pink is absolutely perfect it defines my lips while still blending in with my skin as a nude liner should",2024-02-05,4,"verified purchase"
"1361","nyx-professional-makeup-peekaboo-neutral","love it","mariam a","its very pretty and i would consider it a staple in my makeup bag",2024-02-27,4,"verified purchase"
"1362","nyx-professional-makeup-peekaboo-neutral","great color","chandler","i love nyx products and this is the perfect lip line color to go with any lipstickgloss shade",2024-02-23,5,"verified purchase"
"1363","nyx-professional-makeup-peekaboo-neutral","love it","lucille tucker","i love nyx products they are long lasting and reasonable in price",2024-02-25,5,"verified purchase"
"1364","nyx-professional-makeup-peekaboo-neutral","beautiful neutral color","amazon customer","the lip  liner glides on nicely it is long lasting and a beautiful neutral goes with many of my lip glosses my lips look absolutely beautiful",2024-02-14,5,"verified purchase"
"1365","nyx-professional-makeup-peekaboo-neutral","its so creamy","audryna","i love it it is so easy to put on it shows up really nice and goes good with every gloss",2024-02-18,5,"verified purchase"
"1366","nyx-professional-makeup-peekaboo-neutral","pretty","cafhair","feels great and pretty shade",2024-02-28,5,"verified purchase"
"1367","nyx-professional-makeup-peekaboo-neutral","nice color but alittle hard","lisa","liked color but texture alittle hard",2024-02-11,5,"verified purchase"
"1368","nyx-professional-makeup-peekaboo-neutral","super pretty color","allison coker","color matches my lips perfectly so pretty",2024-02-23,4,"verified purchase"
"1369","nyx-professional-makeup-peekaboo-neutral","love","shantia shand","great product",2024-02-28,5,"verified purchase"
"1370","nyx-professional-makeup-peekaboo-neutral","excelente producto","vane","es perfecto para usar tu labial",2024-02-22,5,"verified purchase"
"1371","nyx-professional-makeup-peekaboo-neutral","coffee","lindseylove","i love this lip liner in coffee the name is deceiving it isnt brown at all it is more of a rosy nude i have been having a hard time finding an everyday lip color that pairs well with my light neutral skin everything seems too dark or washes me out this is the liner all over my lips with a little balm on top i love the color so much i wear it like this often as well as a liner with other lip colors i wish they had this exact color in a liquid lipstick or stain so pretty i would recommend",2024-01-06,4,"verified purchase"
"1372","nyx-professional-makeup-peekaboo-neutral","must have","lindseylove","i love this lip liner",2024-02-21,5,"verified purchase"
"1373","nyx-professional-makeup-peekaboo-neutral","wish it was a darker color","ms","goes on smooth and very pretty just wish i ordered a darker brown",2024-02-15,5,"verified purchase"
"1374","nyx-professional-makeup-peekaboo-neutral","overall it has excellent","raven tousaint","nice colors",2024-02-25,5,"verified purchase"
"1375","nyx-professional-makeup-peekaboo-neutral","very gooodd linerrrr for two toned lips","hind essoussi","very good liner for two toned lips and browncaramel skin tone girls like me makes lip combos super duper natural and matches natural lip color only downside i would say is to make sure u have a sharpener because it is not a twistable one",2024-01-06,5,"verified purchase"
"1376","nyx-professional-makeup-peekaboo-neutral","great but not as smooth as i thought","at","its really good but its not as smooth as i would like if you like a precise little rough lip liner its great",2024-01-17,5,"verified purchase"
"1377","nyx-professional-makeup-peekaboo-neutral","must have nude lip liner","carlos montemayor","my makeup bag wouldnt be complete without it greta onto over line the pups very muted color great for the nomake up look",2024-02-04,4,"verified purchase"
"1378","nyx-professional-makeup-peekaboo-neutral","gets the job done","rayna olivas","i really love the pigment of the pencil my only thing is how hard it is when putting it on i know that it comes with choosing a wood one so that would be the only reason i would look at their other lip liners",2023-12-31,4,"verified purchase"
"1379","nyx-professional-makeup-peekaboo-neutral","bueno me gusta","raven","excelente",2024-02-21,5,"verified purchase"
"1380","nyx-professional-makeup-peekaboo-neutral","goes on smooth","belen torres","love",2024-02-18,4,"verified purchase"
"1381","nyx-professional-makeup-peekaboo-neutral","love it until i lost it","tc","good product but i lost it  days later",2024-02-12,4,"verified purchase"
"1382","nyx-professional-makeup-peekaboo-neutral","correct color runs out really fast","kinley burroughs","this liner color was exact to the color it is online and is very easy to apply but it does run out really quickly and i have to constantly use like a pencil sharpener to sharpen it",2023-12-25,5,"verified purchase"
"1383","nyx-professional-makeup-peekaboo-neutral","great product","gr","i really like this product ",2024-02-09,4,"verified purchase"
"1384","nyx-professional-makeup-peekaboo-neutral",NA,"aniya dumas","i love this lip liner it matches my lips perfectly i always get these every  months",2024-01-31,5,"verified purchase"
"1385","nyx-professional-makeup-peekaboo-neutral","too dry","mahsa mozafarinia","i did not like this product it is too dry for lips in my mind i like something that is a little bit oily and moves on lips easily",2023-12-28,5,"verified purchase"
