"","prod_name","title","reviewer","review","date","ratings","type_of_purchase"
"1855","nyx professional-makeup-wonder-universal",NA,NA,NA,2022-09-17,5,"verified purchase"
"1856","nyx professional-makeup-wonder-universal","only regret is that it isnt as pigmented as i had hoped the good thing is you can build on the layers","corine","came on time only regret is that it isnt as pigmented as i had hoped the good thing is you can build on the layers",2016-01-08,3,"verified purchase"
"1857","nyx professional-makeup-wonder-universal","good product","faur cristina","the highlighter part broke very easily but it can still be usedi use it all the time because the contour its exactly what i needed",2023-12-08,5,"verified purchase"
"1858","nyx professional-makeup-wonder-universal",NA,NA,"    ",2021-11-11,5,"verified purchase"
"1859","nyx professional-makeup-wonder-universal","buon prodotto","michela sartori","ottimo  consigliato",2023-01-10,1,"verified purchase"
"1860","nyx professional-makeup-wonder-universal","me encant","laura","es el primer do que compr no soy maquillista profesional pero me encant cumple mis expectativas lo entregan sper rpido",2021-10-05,4,"verified purchase"
"1861","nyx professional-makeup-wonder-universal",NA,NA," ",2022-04-04,4,"verified purchase"
"1862","nyx professional-makeup-wonder-universal","excellent contour side highlighting side is only ok","tan","this contour stick is ok the contour side is very good and rubs in very well however the highlighting side on my slightly pale skin is not light enough so i use a separate highlighter i suppose the product would be better for those with darker skin shades provided the contour side is dark enough all in all however the contour side does provide a great colour and effects it doesnt have the reddish shade ive found with most powder contours plus it blends as well as any powder if not better",2015-08-10,4,"verified purchase"
"1863","nyx professional-makeup-wonder-universal","good","mariam","good for beginners",2016-01-11,4,"verified purchase"
"1864","nyx professional-makeup-wonder-universal","odd formula","msbouvary","this is supposed to be old formula that i used before and love it now this one is like a bad copy od nyx the white part supposed to be matte not shiny like this one and its almost ivisible when i put it on another product gone to garbage and waste my money",2023-02-20,3,"verified purchase"
"1865","nyx professional-makeup-wonder-universal","lsst sich gut auftragen und verwischen","annili","also der stift ist empfehlenswert die kontur sieht natrlich aus der highlighter nicht so wie glitter die auftragung und das verwischen klappen easy man kann ihn suoer auch unterwegs benutzen der preis ist auch gut keine pickelchen o verschwimmt auch gut in kombination mit anderen produkten sowohl mit schwmmchen als auch pinsel zu smudgen allerdings hlt er nicht besonders lange finde ich das ist ein nachteil ein anderer nachteil wenn man jetzt eher dieses schattierungskonturieren machen will braucht man eher so einen graubraun ton damit das dann natrlich ist dieser stift ist eher in richtung rehbraun fr die blichen wrme bronzer effekte ich komme mit den anderen hochwertigeren graubraunen die auch eine festere textur haben nocht so super zu recht vielleicht kann ich die technik noch nicht so gut weshalb ich dann dennoch diesen rehbraunen ton bevorzuge aber die konsitenz festigekit und haltbarkeit sind seltsamerweise bei den teureren stiften  und somit eben die qualitt doch besser nichtsdestotrotz  ich wrde ihn wieder kaufen und empfehle ihn weiter",2021-11-25,1,"verified purchase"
"1866","nyx professional-makeup-wonder-universal","comodo ma poco duraturo","bvittoria","lo stick  molto comodo da usare per fare un contouring leggero purtroppo per i colori tendono ad essere poco persistenti sulla pelle e bisogna stratificare il prodotto cosa che fa si che la pelle tenda a lucidarsi soprattutto per chi lha mistalo consiglio per chi ha la pelle secca ma comunque applicandovi sopra un prodotto in polvere per aumentarne la durata",2023-06-08,4,"verified purchase"
"1867","nyx professional-makeup-wonder-universal","cooler stick","aline","nicht schlecht ton passt fr meinen hellen hauttyp sehr gut",2022-09-14,3,"verified purchase"
"1868","nyx professional-makeup-wonder-universal",NA,"ma",NA,2020-12-07,5,"verified purchase"
"1869","nyx professional-makeup-wonder-universal","damaged product","doctor n","i received this in a damaged state with the contour end sticking to the cap but as no action was initiated by the seller amazinglyfab  i used it anyway not wanting to waste iti have it in medium shade and the contour part is creamy and well made for the purpose just some powdering and it does a nice jobthe highlighting part is okay nothing to greatthe products contour part is nice but will not be buying from the same seller again will stick to my older trustworthy sellers though pricey",2016-05-04,4,"verified purchase"
"1870","nyx professional-makeup-wonder-universal","love it","doctor n","love",2023-01-07,1,"verified purchase"
"1871","nyx professional-makeup-wonder-universal","product was delivered in good condition was expecting contouring shade to be little ","shiwang kumar","product was delivered in good conditionwas expecting contouring shade to be little more dark but with the current shade it gives natural look with is great as well",2017-05-17,4,"verified purchase"
"1872","nyx professional-makeup-wonder-universal",NA,"amazon",NA,2022-02-27,4,"verified purchase"
"1873","nyx professional-makeup-wonder-universal","muy padre","cliente de amazon","muy padre",2021-10-09,3,"verified purchase"
"1874","nyx professional-makeup-wonder-universal","fantastico","francesca","adoro la nyx credo che sia una delle migliori marche per il rapporto qualit prezzodato che i prodotti  quasi tutti almeno sono paragonabili a quelli della mac per durata e pigmentazione ma ad un prezzo molto pi contenuto questo matitone per il counturing  uno dei miei prodotti preferiti il colore  io prendo luniversal  estremamente naturale e si accorda alla perfezione con il mio incarnato molto chiaro la soluzione in stick permette di applicare il prodotto nei punti esatti e la cremosita del prodotto permette di lavorare e stendere bene la tinta senza creare macchie  il colore chiaro  praticamente un illuminante e nn un correttore  questo nel colore universal in altre tinte invece  pi compatto ed aiuta quindi facilmente a creare luci ed ombre adoro questo prodotto perch permette di ottenere un buon counturing anche alla mano meno esperta ed inoltre quando la mattina vai di fretta  la manna dal cielo dato che in pochi minuti riesci ad avere un buon risultato",2022-01-17,5,"verified purchase"
"1875","nyx professional-makeup-wonder-universal","bof","francesca","ne tiens pas dans le temps  trop crmeux et sestompe trop facilement  je suis ple voir blanche jai donc pris une teinte claire mais je regrette car on ne voit rien",2021-10-15,5,"verified purchase"
"1876","nyx professional-makeup-wonder-universal","not good for nyx","stphanie couprie mille","i brought this purely for the brand name i was looking for a new contour and thought id choose a brand that everyone normally raves about i was excited to receive it however when i first used it it went oh well however after a couple of brushes with a contour brush or make up sponge there was no pigment left on my face its very creamy however lacks the pigment and staying power of just five seconds under soft bristles",2022-04-03,5,"verified purchase"
"1877","nyx professional-makeup-wonder-universal","zu teuer","cherryheaven","bestimmt ein tolles produkt nur leider nichts fr mich",2023-03-02,3,"verified purchase"
"1878","nyx professional-makeup-wonder-universal","fine but not secure","jessica","the brown contour stick came squished onto the lid and when the lid was removed the whole stick came out didnt expect that from nyx though",2021-12-01,3,"verified purchase"
"1879","nyx professional-makeup-wonder-universal","let the pictures explain","neha","the product melted and stick to the cap when i open it the whole product was pulled out too ",2022-03-16,3,"verified purchase"
"1880","nyx professional-makeup-wonder-universal","as a beginner this contour stick made it easy to learn how to contour","nednapa pagornsirikul","as a beginner this contour stick made it easy to learn how to contour its super easy to apply yeah it may be a tad greasy but its easily fixed underneath powder i would recommend using a translucent powder however as the highlighting disappears when using a coloured powder the only downside to this though is that you dont get much in the stick and runs out really quickly i bought mine about  weeks ago and im already buying another well worth the money for what it does and how easy it is to handletip if youre not using translucent powder it works best for me to dab with a brush i found than to blend it all in the only part i would recommend blendingsmudging whatever you want to call it is the cheekbone contour hope this helps will most definitely continue to buy this product one after the other and will never stop using",2016-04-13,3,"verified purchase"
"1881","nyx professional-makeup-wonder-universal","ottimo prodotto","camilla","per quello che costa  un prodotto eccellente lho riacquistato",2023-06-28,4,"verified purchase"
"1882","nyx professional-makeup-wonder-universal","good","izzy","its really easy to blend and feels creamy on skin",2022-05-26,5,"verified purchase"
"1883","nyx professional-makeup-wonder-universal","disappointed","rach ob ","doesnt really blend in ",2021-05-19,5,"verified purchase"
"1884","nyx professional-makeup-wonder-universal","trs decue pascouvrant du tout","jojo","tres decue je trouve que cest de la publicit mensongre car les photos ne sont aps reprsentatives de la ralit les couleurs ne sont pas du tout couvrantes le beige de la couleur universel est transparent paillet et ne se voit pas sur la peauje suis extrmement due davoir jet e a la poubelle",2022-02-11,2,"verified purchase"
"1885","nyx professional-makeup-wonder-universal","el primer da que lo us el corrector oscuro se sali de","rocio","el producto es bueno si matizar pero el primer da se sali el tono oscuro y ahora lo tengo que usar con mucho cuidado",2021-07-24,1,"verified purchase"
"1886","nyx professional-makeup-wonder-universal","toll und sogar vegan","justme","das produkt ist toll ist auch geeignet fr leute die nicht so hufig bzw viel erfahrung mit konturprodukten haben ein weitere kaufgrund war fr mich das dieses produkt vegan ist werde ihn auf jeden fall wieder kaufen",2021-06-29,3,"verified purchase"
"1887","nyx professional-makeup-wonder-universal","not disappointed","sarah c","i used to use this product a couple years ago and loved it so i thought i would give it a go again the product applied beautifully doesnt look textured on top of already applied foundation and is buildable the texture when applying is creamy not dry or chalky blended out with ease i used a brush colour as described nothing bad to say about this product",2021-10-12,5,"verified purchase"
"1888","nyx professional-makeup-wonder-universal","super","laura","den bestelle ich gerne wieder",2023-05-06,5,"verified purchase"
"1889","nyx professional-makeup-wonder-universal",NA,"amazon ","nyx",2020-09-14,4,"verified purchase"
"1890","nyx professional-makeup-wonder-universal","non mi piace","sofia anzaldi"," troppi burroso non appena cerco di applicarlo sembra quasi che tolga tutto quello che c sotto",2023-07-31,3,"verified purchase"
"1891","nyx professional-makeup-wonder-universal","maquillaje","katia s","la mejor compra que he hecho me maquillo super rpido y queda perfecto el maquillaje es lo suficiente cremoso para distribuirse y est muy prctico el paquete",2018-11-02,4,"verified purchase"
"1892","nyx professional-makeup-wonder-universal","great for contour not so much for highlight would recommend","eden","i love the contour side of this stick although the highlight leaves much to be desired the contour shade is great for my skin tone i have yellowolive pale skin and is easily blendable with my foundation however the highlight is difficult to apply without wiping off your foundation so i would say get a complementary powder highlight for a better effect overall  really love thisphotos included are one without and one with flash of both the highlight and contour",2015-12-02,5,"verified purchase"
"1893","nyx professional-makeup-wonder-universal","sehr zufriedenstellend ","eden","ich kann nichts negatives ber den stick sagen er erfllt seinen zweck fr den preis kann man auch nicht all zu viel erwarten doch wie gesagt ich bin sehr zufrieden damit die konsistenz ist angenehm lsst sich gut verblenden kann die haltbarkeit nach dem auftragen allerdings etwas einschrnken besonders bei dem kommenden warmen wetter die farbnuance passt perfekt zu meiner sehr hellen haut",2017-05-26,5,"verified purchase"
"1894","nyx professional-makeup-wonder-universal","ok","andrea nina","not so good for me",2018-11-15,5,"verified purchase"
"1895","nyx professional-makeup-wonder-universal","me encant","amazon customer","lo ameee difumina sper bien lleg en buen estado y muy buen precio",2019-05-30,5,"verified purchase"
"1896","nyx professional-makeup-wonder-universal","the contour side was a good colour however broke off","diana gonzalez","far too oily for my skin the hilight hardly showed up the contour side was a good colour however broke off  expected this product to be better considering how much i paid",2016-01-28,2,"verified purchase"
"1897","nyx professional-makeup-wonder-universal","bello ma texture troppo morbida","amazon customer","un buon prodotto buon prezzoqualit ma per quello che mi aspettavo ha una texture troppo morbida per cui dopo un po viene assorbita dalla pelle e si vede molto menoil counturing fatto abbastanza soddisfatta",2022-04-25,5,"verified purchase"
"1898","nyx professional-makeup-wonder-universal","supprised me","stefy","wow so really easy to use i  extreamly fair colour spot on very easy to blend very natural but can be built will be repurchasing cant believe the value of this",2022-09-03,1,"verified purchase"
"1899","nyx professional-makeup-wonder-universal","great product","rj","it is the perfect color i blends wonderfully",2024-01-30,4,"verified purchase"
"1900","nyx professional-makeup-wonder-universal","pretty good bang for your buvk","tracy cummings","this is a pretty good bang for your buck you get two things for the price of one it is easy to use and i liked both shades it was also easy to blend out",2023-12-15,5,"verified purchase"
"1901","maange-professional-foundation-eyeshadow-blackgold","all the makeupbrusches you need","jan","i have bought this collection of brushes for a christmas presenta quality product presented with a carry case for the brushes",2023-12-13,4,"verified purchase"
"1902","maange-professional-foundation-eyeshadow-blackgold","buen producto","rarch","great quality  great price  excellent brush kit",2023-09-07,5,"verified purchase"
"1903","maange-professional-foundation-eyeshadow-blackgold","wie beschrieben","t p levertonsargent","cant say i know what all the brushes are for specifically but i use them as i need  they are good",2023-07-05,5,"verified purchase"
"1904","maange-professional-foundation-eyeshadow-blackgold","its looks more rose gold","marie","this set of makeup brushes covers most of what you need to apply a normal makeup makeup artists may disagree but i think so some customers complain of a bad smell when unpacking the brushes but i dont think it was that bad at all the brushes are packed individually in a case which i feel is rather poor and which i dont use the feeling i got when i unpacked the brushes was very positive it already felt like they were of good qualityi use the brushes for both makeup base and eye makeup i might think there is a brush missing for eye makeup otherwise i am satisfied brushes do not absorb products and do not lose bristles they are soft and easy to useive only cleaned them twice so far but they seem to hold their shape even thenperhaps i have a strange way of applying foundation as i first spread the foundation with my fingers a little lightly and then use a brush to work the product in one thing annoys me the handle of the brush naturally gets sticky from the product i have on my hand its surprisingly difficult to wipe the brush handle clean afterwardsotherwise i am completely satisfied with this purchase and can really recommend this set of makeup brusches",2023-08-07,5,"verified purchase"
"1905","maange-professional-foundation-eyeshadow-blackgold","great quality","mara","recomendado bonito suave y prctico muy completo",2023-12-27,5,"verified purchase"
"1906","maange-professional-foundation-eyeshadow-blackgold","alles was frau braucht","silvia rahn","die pinsel sehen hochwertig aus und fhlen sich auch so an schne kleine aufbewahrungstasche",2023-07-31,5,"verified purchase"
"1907","maange-professional-foundation-eyeshadow-blackgold","love them","melissa","but other then that its perfect",2024-02-16,5,"verified purchase"
"1908","maange-professional-foundation-eyeshadow-blackgold",NA,"melissa","great value and speedy delivery",2023-08-02,5,"verified purchase"
"1909","maange-professional-foundation-eyeshadow-blackgold",NA,"physically challenged ministry","das set beinhaltet alle ntigen pinsel um ein komplettes makeup zu kreieren die pinsel liegen sehr gut in der hand und verlieren keine haare ich habe sie zum teil schon einmal ausgewaschen nach dem trocknen sind sie genauso weich wie vorher alles zusammen kommt in einem schnen etui schwarzen etui so kann man sie schnell ins reisegepck packen oder zuhause aufbewahren ohne da man einen becher mit pinseln herumstehen hat finde ich persnlich schner so",2023-02-06,5,"verified purchase"
"1910","maange-professional-foundation-eyeshadow-blackgold",NA,"jbernhard wagner","they feel durable not like other brushes that feel loose from the plastic part i really like them overall",2024-02-02,5,"verified purchase"
"1911","maange-professional-foundation-eyeshadow-blackgold","great value product","llynn","love these for the price  soft and hold powders well  clean gently and they will last longer",2023-10-04,4,"verified purchase"
"1912","maange-professional-foundation-eyeshadow-blackgold","muy buenos y suaves","abril castro","fue un regalo para viaje y son muy prcticos y elegantes por su color me gustaron",2024-02-05,5,"verified purchase"
"1913","maange-professional-foundation-eyeshadow-blackgold","brushes did a fine job applying  makeup","tracie schultz","like the fact you got different sizes  for parts of the face no shedding",2022-09-01,5,"verified purchase"
"1914","maange-professional-foundation-eyeshadow-blackgold","son tiles y suaves","brenda martinez","me gustarn mucho el material es muy suave pero se es cae mucho pelo funcionan muy bien para difuminar y aplicar productos",2024-01-29,4,"verified purchase"
"1915","maange-professional-foundation-eyeshadow-blackgold","bonne qualit pour le prix","lb","pour mon maquillage",2023-06-10,4,"verified purchase"
"1916","maange-professional-foundation-eyeshadow-blackgold","farbe wird super aufgenommen","amazon kunde","die pinsel sind super sie nehmen den puder concealer etc sehr gut auf und lassen sich gleichmig auf dem gesicht verteilen ich wrde sie wieder kaufen",2023-03-17,4,"verified purchase"
"1917","maange-professional-foundation-eyeshadow-blackgold","love it","gabriela orozco lemuz","muy buena calidad y la bolsa perfecta",2023-12-14,4,"verified purchase"
"1918","maange-professional-foundation-eyeshadow-blackgold",NA,"stephanie","i love how this pouch has everything in it and you could even fit more make up or brushes in there i do wish it had some slots to hold the brush or the sponge just for more organization  but the brushes are super soft and beautiful and doesnt seem cheaply made i believe youre paying a good price for what its worth",2022-12-20,5,"verified purchase"
"1919","maange-professional-foundation-eyeshadow-blackgold","applies make really well","a diana","there are different sizes of make up brushes in this bag good quality applies make up wellthe big brush to apply your powder is not included",2023-03-04,5,"verified purchase"
"1920","maange-professional-foundation-eyeshadow-blackgold","besser als erwartet","kirstin","zwar viel verpackung  aber viel ergebnis",2022-08-03,5,"verified purchase"
"1921","maange-professional-foundation-eyeshadow-blackgold","qualitt solala","lyndwyn","joa ist ein pinselset die kleinen finde ich sehr gut leider merkt man die qualitt bei den greren pinseln schon stark ungleichmige haarlngen keine starke bindung der schwamm war leider auch nichts fr michaber fr den preis war mir klar dass es abstriche geben wird von  pinseln waren aber gut daher behalte ich das set",2023-01-07,4,"verified purchase"
"1922","maange-professional-foundation-eyeshadow-blackgold","variety of brushes","m elizabeth","these are great soft brushes i like to switch blushes and having extra brushes come in handy i just received these last week so i only used two so far the price was a consideration for me these fit my budget",2022-12-09,3,"verified purchase"
"1923","maange-professional-foundation-eyeshadow-blackgold","buena compra","mariana","me gustan mucho estos pinceles  son muy suaves no pierden las cerdas y ofrecen una variedad de tamaosy formas  vienen en un bonito y practico estuche recomendado al ",2024-01-15,5,"verified purchase"
"1924","maange-professional-foundation-eyeshadow-blackgold","great value","kimberly gonsalves","does what it needs to do",2023-04-28,5,"verified purchase"
"1925","maange-professional-foundation-eyeshadow-blackgold","weich aber stinken","amazon kunde","die pinsel fhlen sich gut auf der haut an  geben jedoch auch nach  monaten noch einen sehr unangenehmen geruch von sich ich bin mir allerdings nicht sicher ob es die pinsel oder das mppchen dabei ist",2023-01-02,5,"verified purchase"
"1926","maange-professional-foundation-eyeshadow-blackgold","not at all travel sized","dannielle cervantes","theyre normal sized brushes and pretty big bag too if its being called travel brushes it should be travel sized",2023-02-11,3,"verified purchase"
"1927","maange-professional-foundation-eyeshadow-blackgold","big brush is very soft","katgv","doesnt work well for my liquid makeup disappointing ",2023-08-11,3,"verified purchase"
"1928","maange-professional-foundation-eyeshadow-blackgold","excelentes","itzel gamio gonzlez","me encantan estar muy completas",2023-12-04,3,"verified purchase"
"1929","maange-professional-foundation-eyeshadow-blackgold","makeup brushes","wicked v","great assortment of bruushen seems to be good quality",2023-07-29,5,"verified purchase"
"1930","maange-professional-foundation-eyeshadow-blackgold","kein pinselreiniger enthalten auch kein schwamm","joachim","daher gefllt mir das gelieferte nicht",2023-04-25,5,"verified purchase"
"1931","maange-professional-foundation-eyeshadow-blackgold","could be better","judith","the brushes looked okay however it would be very helpful to have the name of the brush printed on the brush example  eye shadow blush powder etc  for that reason i returned the brushes",2022-10-14,4,"verified purchase"
"1932","maange-professional-foundation-eyeshadow-blackgold","perfecto","coolestrachel",NA,2024-01-18,3,"verified purchase"
"1933","maange-professional-foundation-eyeshadow-blackgold","surprisingly good","pamela c norman","just received my brushes today and must say i was pleasantly surprised all were individually wrapped and came in a spacious case the brushes feel soft and look professional for the price a terrific product for the money",2022-06-16,5,"verified purchase"
"1934","maange-professional-foundation-eyeshadow-blackgold","muy util","pilar guzmn","es muy til y trae varios pinceles para diversas etapas de maquillajeme agrado",2023-10-17,5,"verified purchase"
"1935","maange-professional-foundation-eyeshadow-blackgold","nein danke","m tritscher","starker chemischer geruch unzureichende qualitt",2023-04-27,4,"verified purchase"
"1936","maange-professional-foundation-eyeshadow-blackgold","not worth ","sarah cowie","nor worth the money maybe if they were a cheaper price i thought the case has individual holders for the brushes but it does not they also smell really bad from the packaging",2022-08-09,1,"verified purchase"
"1937","maange-professional-foundation-eyeshadow-blackgold","muy bien","laura acevedo","bueno",2024-01-13,2,"verified purchase"
"1938","maange-professional-foundation-eyeshadow-blackgold","buenas","pues la abr a mi parecer es cabello sinttico est muy brilloso  es feo que engaen a la gente poniendo que es cabello humano cuando no lo es","brochas tiles acorde a su costo",2023-11-19,5,"verified purchase"
"1939","maange-professional-foundation-eyeshadow-blackgold","suaves y bellas","nahlleli civi chilpa galvn","son sueves y el diseo es bello",2023-11-06,4,"verified purchase"
"1940","maange-professional-foundation-eyeshadow-blackgold","bien","jazmin","la brocha para esparcir el maquillaje liquido pica un poco pero funcional",2023-10-26,4,"verified purchase"
"1941","maange-professional-foundation-eyeshadow-blackgold","excelente","esmeralda vzquez aceves","muy buena calidad super suaves y todo llego muy bien empacado",2023-11-22,4,"verified purchase"
"1942","maange-professional-foundation-eyeshadow-blackgold","perfectas para el uso diario","tadeo terrazas","tena miedo que fueran brochas de baja calidad pero de lo contrario me gustaron mucho la verdad recomiendo mucho y sobre todo son mega suaves",2023-10-29,5,"verified purchase"
"1943","maange-professional-foundation-eyeshadow-blackgold","buenas por lo que cuestan","alix ocampo","vienen muy completas fcil de limpiarse perfectas para viajes cada brocha es muy ligera y el tamao de cada una es perfecto ni muy grandes ni muy chicas",2023-08-31,5,"verified purchase"
