"","prod_name","title","reviewer","review","date","ratings","type_of_purchase"
"1","maybelline-instant-rewind-circles-concealer",NA,"suzan","great coverage great product",2024-01-17,4,"verified purchase"
"2","maybelline-instant-rewind-circles-concealer",NA,"tricia","this is the best price for the best concealer i have ever used i will be buying more",2023-12-12,5,"verified purchase"
"3","maybelline-instant-rewind-circles-concealer",NA,"v","lighter than the photo and makes my under eye way too bright",2021-02-15,3,"verified purchase"
"4","maybelline-instant-rewind-circles-concealer",NA,"jess","works great",2019-06-29,5,"verified purchase"
"5","maybelline-instant-rewind-circles-concealer",NA,"nemai","value for money",2022-07-28,5,"verified purchase"
"6","maybelline-instant-rewind-circles-concealer",NA,"melanie","great product but sometimes the foam comes off and will not reattach",2020-06-15,1,"verified purchase"
"7","maybelline-instant-rewind-circles-concealer",NA,"zobi","great",2020-07-14,5,"verified purchase"
"8","maybelline-instant-rewind-circles-concealer",NA,"maree cooper","love this product",2019-09-28,3,"verified purchase"
"9","maybelline-instant-rewind-circles-concealer",NA,"amazon customer","was excited to use the product it looks fine from outside but nothing is inside looks like expired or all dried up inside the tiny bottle what should i do with it",2020-07-13,5,"verified purchase"
"10","maybelline-instant-rewind-circles-concealer",NA,"kim merrick","amazing",2019-08-16,5,"verified purchase"
"11","maybelline-instant-rewind-circles-concealer",NA,"suzan","sits in my fine lines under my eyes highlights pores",2024-01-17,4,"verified purchase"
"12","maybelline-instant-rewind-circles-concealer",NA,"tricia","doesnt work was all dried out  waste of money",2023-12-12,5,"verified purchase"
"13","maybelline-instant-rewind-circles-concealer",NA,"caroline lake","got quickly and works great",2021-12-10,3,"verified purchase"
"14","maybelline-instant-rewind-circles-concealer",NA,"vanshu","happy with product price and delivery",2021-09-06,1,"verified purchase"
"15","maybelline-instant-rewind-circles-concealer",NA,"bringbackusaamazon","just a tip for husbands who buy these as a gift for your wifeone is apparently enough three is enough to last  years just saying",2018-10-30,1,"verified purchase"
"16","maybelline-instant-rewind-circles-concealer",NA,"ana","my all time favourite concealer  great creamy consistency not too heavy and blends nicely with my foundation  nice and convenient to carry in handbag and travel with",2023-03-31,5,"verified purchase"
"17","maybelline-instant-rewind-circles-concealer",NA,"ben slater","finally a concealer that actually conceals im  and have both wrinkles and very dark rings under my eyes completely covered the dark rings and softened the wrinkles blends nicely so you cant tell youve got concealer on",2018-12-26,5,"verified purchase"
"18","maybelline-instant-rewind-circles-concealer",NA,"michelle pye","this is a repurchase as this product is just what you want it does what you want without looking cakey",2020-07-20,5,"verified purchase"
"19","maybelline-instant-rewind-circles-concealer",NA,"susan","great item excellent price",2021-07-13,5,NA
"20","maybelline-instant-rewind-circles-concealer",NA,"ellice","renewed my makeup",2021-01-02,5,NA
"21","maybelline-instant-rewind-circles-concealer","muy bueno","suzan","great colour ",2024-01-17,4,"verified purchase"
"22","maybelline-instant-rewind-circles-concealer","es un producto estrella mi mam lo sigue eligiendo a travs de los aos","tricia","favourite product",2023-12-12,5,"verified purchase"
"23","maybelline-instant-rewind-circles-concealer","ottimo prodotto prezzo vantaggioso","tracy green","love this  makes my eye bags disappear",2022-03-03,3,"verified purchase"
"24","maybelline-instant-rewind-circles-concealer","per occhiaie","amtur","good coverage",2020-10-04,5,"verified purchase"
"25","maybelline-instant-rewind-circles-concealer",NA,"joanafoe","blends well and stays true to colour",2021-02-28,5,"verified purchase"
"26","maybelline-instant-rewind-circles-concealer",NA,"rima","glides on and offers a moisture finishgreat for dehydrated eyes",2022-05-31,5,"verified purchase"
"27","maybelline-instant-rewind-circles-concealer",NA,"glenda w","mejor corrector",2022-08-23,5,"verified purchase"
"28","maybelline-instant-rewind-circles-concealer",NA,"mia mellamocca","mi mam dice que es el mejor corrector que ha probado su cobertura es excelente el color es ideal para dar luz sin ser demasiado es suave y no marca las lneas de expresin lleva aos usando y lo sigue eligiendo al paso de los aos",2023-04-07,5,"verified purchase"
"29","maybelline-instant-rewind-circles-concealer",NA,"amazon customer","the media could not be loaded                                                                        ho preso questo prodotto perch lo conoscevo gi e mi ci trovo molto bene il prezzo qui su amazon era davvero vantaggioso rispetto a quello nei negozi vicino casa lunica pecca  stata aspettare un pochino di pi rispetto al solito di amazon per la consegna ma comunque parliamo di pochissimi giorni ma ovviamente non  stato assolutamente un problema consiglio questo prodotto si applica direttamente dal tubetto in quanto superiormente ha una sorta di spugnetta da cui esce il prodotto  tramite cui si applica",2019-05-24,5,"verified purchase"
"30","maybelline-instant-rewind-circles-concealer",NA,"adriana pacheco","facile da usare ottima copertura per occhiaie tendenti al verdognolo ne basta poco e poi distendersi bene dura dal mattino alla sera",2024-01-28,5,"verified purchase"
"31","maybelline-instant-rewind-circles-concealer","buen pooducto","suzan","buen producto",2024-01-17,4,"verified purchase"
"32","maybelline-instant-rewind-circles-concealer","love it","tricia","love it",2023-12-12,5,"verified purchase"
"33","maybelline-instant-rewind-circles-concealer","ok","susana","ok",2023-11-25,3,"verified purchase"
"34","maybelline-instant-rewind-circles-concealer","melhor corretivo que j usei","lena","boa cobertura fcil de espalhar no craquela nem marca sempre recompro",2020-08-03,5,"verified purchase"
"35","maybelline-instant-rewind-circles-concealer","good product","kiki","bought for my mum she liked it moisturising as well as good coverage i like to use it too when shell let me ",2020-03-02,5,"verified purchase"
"36","maybelline-instant-rewind-circles-concealer","the best dark circles eraser ever","carlos","this is the second time i have bought this item and its amazing i works miracles and its not available in poland so i always buy it here if you want to get rid of the tiredness from your eye area buy it ",2024-02-16,5,"verified purchase"
"37","maybelline-instant-rewind-circles-concealer","lovely product fantastic seller","lilian rosina prince","i love this concealer and it works great on my combination skin  this shade specifically isnt sold in uk boots or anywhere drug store make up is sold so im glad that i was able to source it here  it arrived well packaged and works well i would recommend this product to anyone",2024-01-07,5,"verified purchase"
"38","maybelline-instant-rewind-circles-concealer","fijn product","amazon kunde","wordt gesealed geleverd wat fijn is want dat is niet met alle makeup dat je online besteldvind het een hele fijne concealer blend natuurlijk in met je huid en dekt voldoendevind het een fijn hyginisch klik draai systeem zelf haal ik het sponje er altijd af en gebruik het met mijn vinger om plekjes op mn huid te corrigeren",2017-01-25,5,"verified purchase"
"39","maybelline-instant-rewind-circles-concealer","bien","crafty traveler","bien",2017-11-30,5,"verified purchase"
"40","maybelline-instant-rewind-circles-concealer","buon prodotto","femke","giusta tonalit ma non  cos antietacome da descrizione",2024-01-06,5,"verified purchase"
"41","maybelline-instant-rewind-circles-concealer","mai pi senza","suzan","questo correttore  la mia salvezza lo uso delle varie colorazioni sia per correggere che per fare il contouring facile da usare resistente leviga e non si sedimenta nelle rughette",2024-01-17,4,"verified purchase"
"42","maybelline-instant-rewind-circles-concealer","this is brilliant immediately helping cover the dark circles and dark ","tricia","i was a little reticent to buy this as there were a few negative reviews however buy i did for me this is brilliant immediately helping cover the dark circles and dark shading on the inside of the bridge of my nose i think i just happened to get the right shade of this first time recommended but does nothing to help bags great for black circles though",2023-12-12,5,"verified purchase"
"43","maybelline-instant-rewind-circles-concealer","smooth","mara","easy to use does what it says",2024-02-12,3,"verified purchase"
"44","maybelline-instant-rewind-circles-concealer","bluffant ","grandma","jai de vilaines cernes marrons qui tirent parfois vers le bleu quand je suis fatigue et depuis des annes je suis  la recherche danti cernes miracles et celui ci est carrment bluffantla matire est crmeuse mais pas trop fluide elle stale bien et surtout se travaille bien au pinceau ou  lponge et la couvrance est bluffante mais il ne faut pas en mettre trop y aller petit  petit lapplicateur est pratique mais veillez  le laver dlicatement de temps en temsp  la tenue est plus que correct pas de retouches dans la journe la matire sche bien et ne fait pas de paquets disgracieux le prix est plus que correct et lavantage de lacheter sur amazon cest quil y a beaucoup plus de choix de teintes que dans les grandes surfaces perso jai regarder quelques vidos avant de me dcider et je ne suis pas due donne vraiment un coup dclat le regard est reveill peut galement servir pour camoufler des imperfections je recommande",2015-10-01,5,"verified purchase"
"45","maybelline-instant-rewind-circles-concealer","relacin calidad precio","suzyque","lo compre para disimular las ojeras  que no tengo muchas  y dar luz al contorno de ojos y la verdad estoy contenta con la compra relacin calidad precio muy buena lo recomiendo si te ha sido de utilidad mi resea hazlo saber gracias",2019-10-23,5,"verified purchase"
"46","maybelline-instant-rewind-circles-concealer","ottimo","sophia","meraviglioso usavo unaltro prodotto da anni ma invecchiando non era pi adatto questo invece  perfetto molto idratante e luminoso sembro ringiovanita di parecchio",2016-11-09,5,"verified purchase"
"47","maybelline-instant-rewind-circles-concealer","happy with the product","didi","went on smoothly feels really nice",2021-03-05,5,"verified purchase"
"48","maybelline-instant-rewind-circles-concealer","am great full","mercury","thank you",2022-03-11,5,"verified purchase"
"49","maybelline-instant-rewind-circles-concealer","perfect","marie oman","the best",2022-09-30,5,"verified purchase"
"50","maybelline-instant-rewind-circles-concealer","timo e rpido","sonnye  van den berg","j conhecia esse produto e gosto muito dele como tbm a minha me lhe adora comprei para ela e ela ficou surpresa da rapidez que chegou e do resultado do corretivo muito bomdirei ok",2020-06-14,5,"verified purchase"
"51","real-technique-miracle-complexion-sponge","super lightweight sponge for makeup","shannon","i would say my makeup skills are pretty beginner to intermediate and this sponge makes it so much easier to apply foundation its super nice and bouncy after i wet it my only concern is that it does seem to soak up the foundation and its hard to wash it out",2024-01-30,4,"verified purchase"
"52","real-technique-miracle-complexion-sponge","au top","jt","gnialissimel application de mon fond de teint est facilit avec cette ponge et le rendu est naturelj adore utiliser ses ponges",2024-02-06,5,"verified purchase"
"53","real-technique-miracle-complexion-sponge","favorite beauty blender","irisaws","can never go wrong with these beauty blenders i normally use the orange but have been loving the blue recently i dampen the orange and blue ones before use but the pink is great dry for powder application",2024-02-17,1,"verified purchase"
"54","real-technique-miracle-complexion-sponge","boa","client damazon"," uma boa esponja mas pareceu mais dura comparada a outras compras que fiz da mesma esponja fiquei at me perguntando se era original mesmo",2017-07-18,5,"verified purchase"
"55","real-technique-miracle-complexion-sponge","precio excelente","sarah scott","encontr este pack a un precio buensimo en el momento en el que las compr en comparacin con lo que suele salir en otras webs la calidad de las esponjas es excelente al humedecerlas su tamao aumenta muchsimo y el material es super suave difuminan genial los productos lquidos y en crema yo las uso para aplicar mi base y el resultado es muy uniforme y luminoso el envo fue correcto",2024-01-03,5,"verified purchase"
"56","real-technique-miracle-complexion-sponge","original product great quality pack of  saves money","danielle de melo gomes","good quality real techniques sponges are better than any other sponges available from different competition brands soft and blends welledit after  months these are original no wear and tear keep them washed and clean they will live longer amazon has unbeatable price people on instagram are selling for double the price",2023-01-28,5,"verified purchase"
"57","real-technique-miracle-complexion-sponge","great for blending many different products","cliente amazon","i like how each colortexture of sponge is intended for different products i believe this is the standard size and i do wish these were slightly bigger but thats just my personal preference i know you can buy a bigger size but i wanted the multipack i will continue to use these beauty blenders for foundation cream bronzer and cream blush i recommend this product",2019-03-06,3,"verified purchase"
"58","real-technique-miracle-complexion-sponge","recomendadas","meher","creo que son unas de las mejores esponjas en calidad precio son de las que tienen buen tacto mojadas y secas tardan mucho en empezar a deshacerse o agrietarse por algunas zonas y apenas se estropean se lavan muy bien y rpido con un poco de agua y jabn y no las gasta",2020-01-25,5,"verified purchase"
"59","real-technique-miracle-complexion-sponge","best of the best","meher","these are amazing wow i ordered these bc of the price and wow was i impressed love having so many on hand bc quite frankly i hate washing them daily and i dont like reusing them once theyve been used and theyre great for applying n foundation i use slightly damp and theyre perfect foundation goes on so smooth and sleek price is great you wont be disappointed i wash them with cerave as thats what my dermatologist said was the best thing to use and that works great",2023-06-11,5,"verified purchase"
"60","real-technique-miracle-complexion-sponge","good product","nick","easy to use",2018-06-26,5,"verified purchase"
"61","real-technique-miracle-complexion-sponge","suaves al tacto de la piel","shannon","le encanto a mi esposa las usa todos los das para arreglarse al salir a su trabajo no entiendo porque la moja pero a pesar de ello se mantiene firme la esponja es un material muy peculiar ya que es absorbente pero no en exceso as que no debera de preocuparse por mojarla demasiado ya que no absorbe gran cantidad de liquidoes muy suave y no guarda olores al menos de la manera que la usa ella observo que crecen un poco de tamao al mojarlasno entiendo mucho el tema de maquillaje pero honestamente la veo muy contenta con el producto as que volvera a compararlas sin dudarlo",2024-01-30,4,"verified purchase"
"62","real-technique-miracle-complexion-sponge","parfait","jt","commande conforme  la commandejai bien reue les  ponges et ce sont bien des authentiques real techniquesje recommanderais",2024-02-06,5,"verified purchase"
"63","real-technique-miracle-complexion-sponge","good product","the crow","i will buy these again",2024-01-26,1,"verified purchase"
"64","real-technique-miracle-complexion-sponge","different packaging","the crow","i bought the sponge set before and noticed that with this newest purchase it shipped from china unlike my first purchase the packaging is also different apparently real techniques products are primarily made in asia as are most other products out there so i guess i received the asian market product no big deal but im just always weary of fakes the sponges seem to be the original product though as they look and perform the same",2017-07-19,5,"verified purchase"
"65","real-technique-miracle-complexion-sponge","suave y blandita","amazon customer","las compr por la recomendacin de una youtuber y realmente no me han fallado me encantan y seguro vuelvo a comprarlas",2024-02-25,5,"verified purchase"
"66","real-technique-miracle-complexion-sponge","die besten","amazon customer","die besten schwmme seit jahren der preis steigt leider auch sttig am besten man wartet bis sie mal wieder im angebot sind",2023-02-10,5,"verified purchase"
"67","real-technique-miracle-complexion-sponge","quality sponges","bridget w","great beauty blender",2019-08-31,5,"verified purchase"
"68","real-technique-miracle-complexion-sponge",NA,"bb","original ",2023-07-07,5,"verified purchase"
"69","real-technique-miracle-complexion-sponge","calidad  precio adecuados","bb","super suaves y esponjosas difuminan el maquillaje excelentemente pero creo que duran menos de lo que esperaba se empezaron a cuartear pronto sin embargo creo que el secreto es manterla hmeda siempre y lavarla con mucho cuidado sin apachurrar mucho y con jabn suave s volver a comprarlas porque an considero que por la relacin precio  calidad sigue siendo una buena opcin",2024-01-24,4,"verified purchase"
"70","real-technique-miracle-complexion-sponge","worth every peny","mada bailn","it is original  its soft  when you wet it it gets super soft  loved the product ",2019-10-01,4,"verified purchase"
"71","real-technique-miracle-complexion-sponge","average makeup sponge","shannon","i like to use these sponges for my concealer they feel the same as the more expensive sponges out there they havent ripped are durable and do the job i put them in my brush cleaning machine and they clean right up and come out in perfect condition",2024-01-30,4,"verified purchase"
"72","real-technique-miracle-complexion-sponge","farbe beim aussplen","jt","ich bin immer sehr zufrieden mit den schwmmen allerdings kam beim ersten aussplen farbe aus dem schwamm",2024-02-06,5,"verified purchase"
"73","real-technique-miracle-complexion-sponge","estupendo","jason h lipsky","llegaron perfectamente embaladas y en fecha como es habitual los productos de rt no defraudan todo lo contrario son de una calidad inmejorable seguro que repetir en cuanto se me acaben",2023-12-24,1,"verified purchase"
"74","real-technique-miracle-complexion-sponge","impressive variety and performance","amazon kunde","i recently purchased the real techniques assorted makeup blending sponges and i must say they have exceeded my expectations this set offers a great variety of sponges each serving a unique purpose making it a versatile addition to any makeup collectionthe quality of these sponges is impressive they are made of a soft and bouncy material that feels gentle on the skin the different shapes and sizes allow for precise application of foundation concealer and other makeup products making it easy to achieve a flawless finishone of the standout features of these sponges is their ability to blend makeup seamlessly they effortlessly blend foundation into the skin leaving no streaks or patches behind the pointed tips are excellent for reaching difficult areas like the undereye and around the nose ensuring a flawless result every time",2021-02-08,4,"verified purchase"
"75","real-technique-miracle-complexion-sponge","great buy","am","exactly what it says it is no idea how some people have gotten fake items  these are the real thing ive used these sponges before so i know exactly how theyre supposed to look feel and work these are authentic they are easy to clean they dont smell funny no dyes run out when washing great deal for  loving this purchase thank you so much and will definitely be repurchasingalso people have stated above the a in real techniques is slanted therefore this brand is fakei live in winnipeg manitoba and in store the a is tilted also so not too sure if they are tilted everywhere but this is the actual real techniques brand",2018-02-18,4,"verified purchase"
"76","real-technique-miracle-complexion-sponge","tres bien ","mandy","vritables ponges real techniquestrs bon rapport qualit  prixje trouve quelles durent plus longtemps que leur concurrente beauty blenderjai deja command ce kit en mai dernier je renouvelle lachatpour lutilisation  les mouiller sous leau essorer comme une ponge normale et appliquer fond de teint avec ponge humideutilises au quotidien laves aprs chaque utilisation avec du savon de marseille pas besoin dun produit spcial savon en pain vendu dans le commerce prfrence pour la marque jeanne en provence vendue chez leclerc par ex et en utilisant les  en alternance elles commencent  seffilocher au bout de  mois sur le paquet il est conseill de les changer au bout de    mois a correspond  mon utilisationavec ce nouveau kit je pense laver les ponges  fois sur  pour les faire durer un peu plus longtempsphoto     kit neufphoto   ponge neuve sortie de la bote elle est plus petite car elle grossit une fois mise sous leauphoto   tat ponge aprs  mois dutilisation rgulire je pourrais men servir encore il devient difficile de la laver sans labmer davantage des petits bouts dponges partent de plus en plus",2023-06-01,5,"verified purchase"
"77","real-technique-miracle-complexion-sponge","the best sponge ever","carla","best best best sponge ever thank you rt",2021-01-24,3,"verified purchase"
"78","real-technique-miracle-complexion-sponge","me encantan las mejores","carla","the media could not be loaded                                                                        me encantaron la azul no esta en la foto porque estaba un poco sucia pero es mi favorita por siempre la rosada la utilizo para colocarme polvo traslcido la color naranja aun no la uso pero le regale una a mi mama y le encanto valen cada peso en realidad nunca haba tenido un aplicador de base tan excelente cmprenlo a ojos cerrados compre el paquete de   las  comparti con mi mama y mi hermana ellas la amaron",2017-11-26,5,"verified purchase"
"79","real-technique-miracle-complexion-sponge","purchase again and again","gl","ive tried other blenders and these are the best i used to buy the  pack but i know im going to keep buying these so now i get this one",2023-06-07,5,"verified purchase"
"80","real-technique-miracle-complexion-sponge","bonnes ponges","gl","parfait",2023-11-24,4,"verified purchase"
"81","real-technique-miracle-complexion-sponge","esponja","shannon","muy buena compra me ha gustado mucho ycomprandolas asi sale mucho mejor de precio asique merece la pena y cuando las mojas deja un acabado muy bueno",2024-01-30,4,"verified purchase"
"82","real-technique-miracle-complexion-sponge","better than a beauty blender","jt","i love these i use zote soap to clean them and i can reuse them for a few weeks much more economical than a beauty blender",2024-02-06,5,"verified purchase"
"83","real-technique-miracle-complexion-sponge","no son las esponjas originales","marian pardo perez","no son las esponjas originales de real techniques son ms duritas ms redondas y llevan la inscripcin rt en la esponja cosa que las originales no hacen su funcin de aplicar la basecorrector aunque rebotan ms en la piel por ser ms duras que las originalesen las fotos izquierda esponja original derecha esta esponja",2018-03-17,1,"verified purchase"
"84","real-technique-miracle-complexion-sponge","best sponges ","sarah","i love these sponges ive gotten so many compliments on my makeup looking airbrushed from using these have recommended to several friends great product ",2024-02-10,5,"verified purchase"
"85","real-technique-miracle-complexion-sponge","besser als der beautyblender","andra raileanu","was soll ich sagen ich liebe sie einfach es sind  stck in der packung und kosten so viel wie ein beautyblender die farbe ist okay ich mag kein orange aber darum geht es ja eher nebenschlich diese makeupschwmmchen sind groartig sie verteilen das makeup optimal wenn man sie anfeuchtet quellen sie fast auf das doppelte ihrer ursprungsgre an was ich echt super finde sie fhlen sich gut in der hand und auf der haut an und lassen sich vor allem auch gut reinigen anders als beim beautyblender wscht sich dabei nicht einmal doe farbe raus dazu zeigen die meisten beautyblender bereits nach der ersten reinigung ihre schwachstellen und gehen kaputt was hier nicht der fall ist jederzeit wieder wobei ich mit  erstmal fr eine weile versorgt sein werde und auf jeden fall weiterzuempfehlen ",2018-04-09,5,"verified purchase"
"86","real-technique-miracle-complexion-sponge","excellent customer serviceproduct","andra raileanu","perfect for flawless makeup application especially for various skin imperfections great price and my order arrived very quickly next daygreat accurate notification",2023-09-22,3,"verified purchase"
"87","real-technique-miracle-complexion-sponge","au top","molly","jai test une premire fois cette ponge en format individuel et depuis je ne peux plus men passer jai du coup achet ce pack au prix hyper intressant petit bmol sur le suivi du colis qui mindique tous les jours que le colis est en livraison je conseille plutt de checker vos mails",2017-05-08,3,"verified purchase"
"88","real-technique-miracle-complexion-sponge","muy precio","jenny r","por el precio que ests pagando de verdad valen la pena tienen alta calidad y son muy suaves si las comparas con otras marcas son excelentes en relacin preciocalidad no es la primera vez que las compro y sin dudarlo las recomiendo y las volvera adquirir",2023-02-15,5,"verified purchase"
