"","prod_name","title","reviewer","review","date","ratings","type_of_purchase"
"679","revolution-loose-baking-powder-banana","good value for money","prachi mishra","i am no expert on products such as these and have limited experience of using setting powders but i found this powder to be good at setting concealer under my eyes and its very good value for money",2023-09-20,5,"verified purchase"
"680","revolution-loose-baking-powder-banana","matifica y sella","nalanda mandal","matifica y sella genial lo que no me gusta es el formato como sale el producto",2023-11-29,4,"verified purchase"
"681","revolution-loose-baking-powder-banana","cipria in polvere","mary c from melbourne","regalata a mia madre ne  rimasta entusiasta ottimo prodotto opacizzante adatto per pelli mature copre senza appesantire e illumina il viso la ricomprer sicuramente anche perch il prezzo  molto vantaggioso",2024-02-22,4,"verified purchase"
"682","revolution-loose-baking-powder-banana","tolles preisleistungsverhltnis","jade gessel","pluspunkte schnelle lieferung preis verpackung und leistung die haltbarkeit des make ups wird verlngertminuspunkte keineergebnis  klare kaufempfehlung",2023-11-17,5,"verified purchase"
"683","revolution-loose-baking-powder-banana","bonne poudre","claudia pinna","une poudre matifiante pas cher et de bonne qualit cependant le flacon est horrible ce bouchon nest pas du tout pratique il est bien trop petit pour mettre la poudre dedanshormis a le rapport qualit prix est bon",2024-02-01,3,"verified purchase"
"684","revolution-loose-baking-powder-banana","cumplio mis expectativas","tamara","the media could not be loaded                                                                                    no tengo queja estoy enamorada de dermacol cubre hasta el apellido lo use para tapar un moreton de un ojo a causa de un accidente y por completo me lo tapo como si nunca hubiera tenido un golpe y lo necesitaba antes de navidad me llego el  estoy tan emocionado con el producto  muy enamorada lo mximo este producto no es de este planeta",2023-11-02,5,"verified purchase"
"685","revolution-loose-baking-powder-banana","scomoda la confezione","julien","buon prodotto ma con una confezione scomoda",2024-02-25,5,"verified purchase"
"686","revolution-loose-baking-powder-banana","bewhrte revolution qualitt","saraih mitre","darf beim makeup nicht fehlen wenn man das baking bevorzugt habe bisher als makeup artist nie ein anderes powder gehabt ich mchte es auch gar nicht ausprobierenes passt sich farblich gut anich nutze es unter den augen ein wenig am nasenrcken ein wenig am kinn einen klecks auf der stirn und jeweils einen schmalen streifen an den wangen unterhalb der dunklen kontur so kommt die kontur besser zur geltungeine gute grundlage ist ein muss die foundation bzw der concealer sollte dafr geeignet sein wer dazu neigt dass sich das makeup in den fltchen absetzt sollte an den stellen auf das powder verzichtenimmer auf die menge achtenich mache mir ein wenig von dem produkt in ein schlchen und nehme es direkt mit dem blending sponge auf und tupfe es damit vorsichtig auf das lasse ich dort so bis ich den rest vom makeup lidschatten etc fertig habe und verblende dann ohne druck alles mit einem groen fluffigen pinsel das lsst das powder ebenmig erscheinen und entfernt berschssiges powderwer probleme mit diesem produkt hat sollte sich erst ein wie mach ich das  video anschauen bevor man dem produkt die schuld gibt denn beim baking kann man viel falsch machen ebenso bei den pinseln und schwmmenwer zu viel powder benutzt oder es mit zu viel druck auftrgt oder verteilt der wird nachher sehen dass das produkt unschne rnder hinterlsst und buchstblich brckeltich hoffe ich konnte helfen",2023-12-21,4,"verified purchase"
"687","revolution-loose-baking-powder-banana","top","saraih mitre","je recommande pour les petit budget",2024-02-04,5,"verified purchase"
"688","revolution-loose-baking-powder-banana","no lid","angela","all i wanted was a replacement for a missing lid so i could transport my powder perfectly happy with the product itself contact the seller i thought so after a lot of emails flying back and forth to revolution including photographs screen shots of order details etc im told because i dont have an order number they recognise the amazon one doesnt cut it who knew they cant help meand anyway they dont stock separate lids so do i pack up and send back the open powder jar to amazon for a refund or replacement probably not but ill certainly think twice about buying anything from revolution through amazon again",2022-05-24,5,"verified purchase"
"689","revolution-loose-baking-powder-banana","good","schumi ","i bought this after running out of my bella pierre banana setting powder its a good replacement and at a cheaper price too having acne prone skin i was concerned after reading some reviews about people breaking out after using this but this has not been my experience thankfullyi would advise that less is more with this as it can be quite drying and if you have an old pot from another powder keep hold of it to decant some of this into to cause boy it aint easy applying from this tub hence one star downall in all pleased with the colour and finish",2024-02-26,4,"verified purchase"
"690","revolution-loose-baking-powder-banana","love this","berrioua","i love this powder this is my second one and ive used other more expensive brands but i keep coming back to thisthe only thing i wish is that it was in a different container as you cant just dab and go you need to pour it on to your hand or another surface first but that aside its great",2022-12-27,5,"verified purchase"
"691","revolution-loose-baking-powder-banana","wie ein filter","mary c from melbourne","mit dem puder sieht das makeup aus wie ein filter ich bin ein braunes mdchen und fr mich ist das bisschen zu gelb obwohl ich gelbes makeup liebe deshalb wenn ihr ein hellen haustyp habt dann lieber ein helleres puder kaufen aber ansonsten ist der preis super",2024-02-22,4,"verified purchase"
"692","revolution-loose-baking-powder-banana","excellent rapport qualit prix ","jade gessel","trs bon produit quantit trs intressante par rapport  la concurrence matifie et fixe le maquillage sans effet pltre et sans besoin den mettre des tonnes je lapplique au kabuki et cest parfait transparent et absolument pas blanc comme dautres poudres libres que jai testes ne dessche pas la peau jai enlev une toile car il faut reconnatre que le packaging nest franchement pas pratique mais jai transvas dans le contenant vide dune autre poudre libre avec tamis et a fait parfaitement laffaire ",2023-11-17,5,"verified purchase"
"693","revolution-loose-baking-powder-banana","top","amo","elle a des sous ton ros mais une fois appliqu cela ne se voie pas hte de tester la tenue",2023-12-22,3,"verified purchase"
"694","revolution-loose-baking-powder-banana","bonne poudre","claireromain","le colis et bien arrive j ai ouvert pour  swatche  ces une bonne poudre merci je recommande ",2024-02-11,4,"verified purchase"
"695","revolution-loose-baking-powder-banana","i like the coverage but the lid is very tiny","buget chantal","the coverage on this powder is great for me the only issue i have is the lid is very tiny and the powder requires a lot of shaking to get enough product out i have to shake more into the lid  times because one brush tap will take up everything in the lid it is a minor inconvenience and i do like the product i just wish that the dispensingholding of powder was more user friendly",2024-02-24,4,"verified purchase"
"696","revolution-loose-baking-powder-banana","lots of product","buget chantal","i really like this powder as it applies to my skin super evenly and it is quite affordable compared to other brands such as hudabeauty my only complaint would the packaging is inconvenient and does make a mess but overall it is worth the price",2024-01-26,4,"verified purchase"
"697","revolution-loose-baking-powder-banana","good price","amanda","beautiful",2024-02-08,4,"verified purchase"
"698","revolution-loose-baking-powder-banana","good","amanda","this is as good as much more expensive finishing powders ive used",2024-02-18,4,"verified purchase"
"699","revolution-loose-baking-powder-banana","buona","rr","ottima per qualit prezzo",2024-02-28,4,"verified purchase"
"700","revolution-loose-baking-powder-banana","missing item","eagsbeags","i am missing one of my items that was supposed to be delivered with the bookshelf holders theres a thing of makeup and it wasnt in the same bag and i dont see that a second package was left",2024-01-26,4,"verified purchase"
"701","kimuse-contour-1contouring-highlight","great idea","deirdre bull","i like the combination of highlighter and contour my makeup bag is full enough",2024-02-10,3,"verified purchase"
"702","kimuse-contour-1contouring-highlight","just what i was looking for except","louietj"," it stinks  i like both ends the color i chose works for my skin  i put highlighter and contour on under my foundation  that may be what helps blending and the colors  but the fragrance is awful",2023-11-17,5,"verified purchase"
"703","kimuse-contour-1contouring-highlight","bon produit","byrd","trs bien fait son job",2024-01-27,2,"verified purchase"
"704","kimuse-contour-1contouring-highlight","not the greatest","kindle customer","works ok but does not spread out very easily would prefer something different",2023-11-05,4,"verified purchase"
"705","kimuse-contour-1contouring-highlight","easily breaks","laurie","works good the highlighter isnt very bright though and its pretty fragile",2023-07-11,4,"verified purchase"
"706","kimuse-contour-1contouring-highlight","meh","oshalynn","it is a good product but one side doesnt twist open",2024-01-21,4,"verified purchase"
"707","kimuse-contour-1contouring-highlight","perfect","jamie","this is the perfect color for my completion and works great",2023-10-08,3,"verified purchase"
"708","kimuse-contour-1contouring-highlight","i wouldve given  but","keyara cooper","i love this product but the caps break and wont stay on hard to keep in your makeup bag with the caps always coming off",2023-09-25,4,"verified purchase"
"709","kimuse-contour-1contouring-highlight","very nice","tiffany copple","it goes on smoothly it matches my skin more than id like but i use it often",2024-01-04,2,"verified purchase"
"710","kimuse-contour-1contouring-highlight","hard to blend","jennifer lewis","its a good product good color but its hard to blend out and can leave smudges and stuff would suggest finding something more blendable but it works",2023-06-08,5,"verified purchase"
"711","kimuse-contour-1contouring-highlight","meh","deirdre bull","i gave it a crappy review because it kind of sucked for me  i have very fair skin and i went with the w medium which is probably my own fault for picking that color  but the brown is so light it almost looks orange  it really is that light  it was my first time trying a cream contour which maybe my own inexperience but i didnt like the feel of it  it felt like a crayola crayon on my face  the stuff was very hard to blend and the colors didnt work well together either  i really regret buying it  maybe trying a different color would be better but i just didnt like it",2024-02-10,3,"verified purchase"
"712","kimuse-contour-1contouring-highlight","bouchons de trs mauvaise qualit","louietj","quel dommage que les  bouchons se cassent trs rapidement car le produit en luimme est trs bien et sapplique facilement",2023-11-17,5,"verified purchase"
"713","kimuse-contour-1contouring-highlight","good coverage for contouring","eb","good coverage for contouring however the color i ordered is a bit more orange than i would have liked i originally ordered this because i wanted to try a cream contour i think i actually prefer a powder contour",2022-12-30,2,"verified purchase"
"714","kimuse-contour-1contouring-highlight","lindo y remarca","amazon customer","me parece un buen producto el contorno remarca los pmulos y el iluminador brilla no tanto pero si es muy bueno",2023-07-24,3,"verified purchase"
"715","kimuse-contour-1contouring-highlight","love it but","tk shopper","i use this everyday and the pigment and texture is great my only problem is it gives me blackheads and makes me break out also it doesnt last it seems to wear off half way through the day",2023-07-04,2,"verified purchase"
"716","kimuse-contour-1contouring-highlight","makeup","maclu","im still learning how to do my own makeup but this was definitely something i will buy again it gives my nose the perfect shape lol",2023-04-13,3,"verified purchase"
"717","kimuse-contour-1contouring-highlight","kimuse contour and highlight stick","yellodog","its a great color for my skin tone and easy to blend",2023-05-21,4,"verified purchase"
"718","kimuse-contour-1contouring-highlight","nice size","hannah rossyion","nice size the highlighter part your make up gets on it",2023-03-09,3,"verified purchase"
"719","kimuse-contour-1contouring-highlight","love it","maria h","this is the nicest product it goes on smooth and it contours well the color is a bit on the darker side but other then that i love how easy it glides",2023-04-30,4,"verified purchase"
"720","kimuse-contour-1contouring-highlight","contorno en barra","zoie","me agrada la textura pero el pigmento es muy pobre casi no deja muy marcado",2023-08-05,4,"verified purchase"
"721","kimuse-contour-1contouring-highlight","its not good","deirdre bull","both sides caps broke after like  days and it is very hard to blend in",2024-02-10,3,"verified purchase"
"722","kimuse-contour-1contouring-highlight","es buena","louietj","no est tan mal pero no tiene una buena cobertura toca usar mucho producto  las tapas se parten muy rpido",2023-11-17,5,"verified purchase"
"723","kimuse-contour-1contouring-highlight","could be softer","kennedy king","not as pigmented and soft as it could be",2023-11-24,2,"verified purchase"
"724","kimuse-contour-1contouring-highlight","two for one","doris diaz","i like this highlighterbronzercontour its a really a nice beauty product its like getting two for the price of one  ive used other contour products and they made me look kind of orange but the colors with this company are good for my complexion  i also like the creamy consistency",2023-02-13,2,"verified purchase"
"725","kimuse-contour-1contouring-highlight","i love product but tops are easily cracked","cristina ortiz","product blends smoothly lasts throughout the day but packaging needs to be stepped up as the clear tops have broken on each end of the wand",2023-07-03,4,"verified purchase"
"726","kimuse-contour-1contouring-highlight","my favorite","amazon customer","one of my go tos when doing a full face makeup look it blends so smoothly and doesnt cake up  it has coverage for building up contour",2023-06-13,3,"verified purchase"
"727","kimuse-contour-1contouring-highlight","love","mandy","its actually great but when i first got it it was pretty hot and kind of melted so i put it in the fridge for about  mins other than that its a great highlighter and contour stick",2023-01-03,5,"verified purchase"
"728","kimuse-contour-1contouring-highlight","inconsistent color","kay ","loved my first one despite the awful caps that broke within a week on my reorder the color was not the same as my first one i bought all the colors and not one matches the originalback to my search for a product i can reasonably rely upon",2023-08-31,4,"verified purchase"
"729","kimuse-contour-1contouring-highlight","so creamy and blendable","anislei","love how smoothly this applies and blends the color is nice with my pinky undertones i do like the contour more than the highlighter though the highlighter has a little bit of a shadow on my skin",2023-07-11,5,"verified purchase"
"730","kimuse-contour-1contouring-highlight","its ok","corgimom","smooth to apply decent packaging  the coloring of the contour end was a bit off for me but im making it work wish it had more girth overall its ok",2023-09-20,5,"verified purchase"
"731","kimuse-contour-1contouring-highlight","me gusto","deirdre bull","buen producto ",2024-02-10,3,"verified purchase"
"732","kimuse-contour-1contouring-highlight","very warm tone","louietj","if you want bronzer then this is a decent product it blends fairly well but it is not a cool tone contour",2023-11-17,5,"verified purchase"
"733","kimuse-contour-1contouring-highlight","this works great","d","this replaced my nyx highlighter concealer i was not finding the nyx and this works great for less money the only problem is with the covers for the ends they crack and  no longer snap on i had the same issue with the nyx hopefully a new design would help the packaging ",2023-02-18,2,"verified purchase"
"734","kimuse-contour-1contouring-highlight","contour is nice but highlighter is not very pigmented","molly","i enjoyed the contour stick but  i did not enjoy the highlighter as much as i anticipated the highlighter is quite weak in pigment lacks that white that shines the contour on the other hand was quite nice its not super dark and its quite milky",2023-03-08,4,"verified purchase"
"735","kimuse-contour-1contouring-highlight","travel worthy","suzie q","bought this for a cruise vacation instead of taking all my makeup need to blend it a little more than typical cream based makeup but it travels very well and fits in my purse if i need a touch yp",2023-03-27,3,"verified purchase"
"736","kimuse-contour-1contouring-highlight","love","alexa","honestly im pretty impressed with this contour stick i was iffy a out ordering a brand im not familiar with but needed a cool toned contour color that didnt break the bank goes on and blends really well",2022-10-05,5,"verified purchase"
"737","kimuse-contour-1contouring-highlight","great color","allison k","this goes on very smooth and has great color for my fair skin tone",2023-05-07,3,"verified purchase"
"738","kimuse-contour-1contouring-highlight","great","crystina herrera","looks great",2023-04-27,5,"verified purchase"
"739","kimuse-contour-1contouring-highlight","just okay","t t","not as blendable as i would like and the color is more orange than expected i got the fair color combo hoping it would be a cooler hue",2023-07-07,5,"verified purchase"
"740","kimuse-contour-1contouring-highlight","amazing  count our stick","brittney rozier","excellent  the color is matching great in my skin color and my nose looks so thin to instant lifting effect i only have to say that i recommend it ",2023-09-01,5,"verified purchase"
"741","kimuse-contour-1contouring-highlight","smooth sailing","deirdre bull","i like that the item is compact and goes on smooth so blendable love it and will order again",2024-02-10,3,"verified purchase"
"742","kimuse-contour-1contouring-highlight","found it not as great as expected","louietj","the stick was drier than expected and pulled on my skin as i used it  i wouldnt purchase this again",2023-11-17,5,"verified purchase"
"743","kimuse-contour-1contouring-highlight","hardley a bronzer","gail r","the colors were off a very light brown and a very light nude not sure how either of those could be used to contour or bronze",2023-05-25,2,"verified purchase"
"744","kimuse-contour-1contouring-highlight","do not buy","sks","product goes on waaay too sheer for a contour stick the brown is orange not brown looks so unflattering packaging is cute but not functional",2022-11-18,5,"verified purchase"
"745","kimuse-contour-1contouring-highlight","its good","maris","not great",2024-01-26,3,"verified purchase"
"746","kimuse-contour-1contouring-highlight","broken","ks bargains","the plastic was broken and the stick was smushed",2023-07-29,1,"verified purchase"
"747","kimuse-contour-1contouring-highlight","good contour but bad highlighter","laura","to sum it up the contour is like any other its very smooth and easy to blend but the highlighter doesnt appear at all it blends into nothing unfortunately",2023-02-20,2,"verified purchase"
"748","kimuse-contour-1contouring-highlight","not what i was expecting","sophie yuck","doesnt apply as nicely as i thought it would",2023-01-09,3,"verified purchase"
"749","kimuse-contour-1contouring-highlight","its ok","bessy reyes","the highlight is hard to blend",2023-03-14,3,"verified purchase"
"750","kimuse-contour-1contouring-highlight","great product","amazon customer","colors come up well on my medium skin tone easy on the go for adding dimension to your skin",2024-02-26,5,"verified purchase"
"751","conceal-correct-contour-palette-3cp01","naja","natascha","erfllt seinen zweck ist aber von der konsistenz nicht unbedingt die beste contur palette sonnst bin ich aber zu frieden",2015-10-18,4,"verified purchase"
"752","conceal-correct-contour-palette-3cp01","makeup nyx","faith","i love it the package is in good condition and it arrived faster than i imagine thank you so much",2020-06-08,2,"verified purchase"
"753","conceal-correct-contour-palette-3cp01","one star","faith","was to hard to use",2015-11-08,5,"verified purchase"
"754","conceal-correct-contour-palette-3cp01","face","samia zamir","wont use anything else so good on your skin and doesnt look cakey",2019-11-23,5,"verified purchase"
"755","conceal-correct-contour-palette-3cp01","fehlkauf","charmaine","ich wrde das produkt wirklich niemanden empfehlen die textur ist so schlecht verarbeitet es lsst sich berhaupt nicht sauber auf das gesicht auftragen nachdem ich super enttuscht wurde habe ich das produkt zurckgeschickt",2015-09-27,1,"verified purchase"
"756","conceal-correct-contour-palette-3cp01","corrector que se aplica antes del maquillaje","miena safi","me encanta usar correctores cuando me maquillo te permite tener un acabado profesionalest a buen precio porque en una paleta tienes  tonos",2023-10-14,5,"verified purchase"
"757","conceal-correct-contour-palette-3cp01","disappointed","alejandra villanueva","product looks like it was already opened the inside is dirty as seen in the photo i wont be using this im scared it might be contaminated",2022-08-11,1,"verified purchase"
"758","conceal-correct-contour-palette-3cp01","blo nicht ",NA,"diese concealer palette ist richtig richtig schlecht die konsistenz ist sehr hart und lsst sich kaum auftragen ein totaler reinfall",2016-01-28,5,"verified purchase"
"759","conceal-correct-contour-palette-3cp01","not worth the money",NA,"the product is really thick and so its hard to put on and work with im really disappointed with it and kind of it regret buying it now",2015-06-26,1,"verified purchase"
"760","conceal-correct-contour-palette-3cp01","new to color correcting","amazon kunde","i only use a small amount and my healing blemishes vanish have tried by itself and with concealer on top and both work well",2024-01-18,1,"verified purchase"
"761","conceal-correct-contour-palette-3cp01","nice colors","deborah flateau","love it",2023-12-03,4,"verified purchase"
"762","conceal-correct-contour-palette-3cp01","very cakey","carly","thought i did enough research on this but its not at creamy as i thought makes my skin look dry coverage is okay but will not use",2024-01-01,4,"verified purchase"
"763","conceal-correct-contour-palette-3cp01","difficult application","ashley friedman","it was smaller than i was anticipating so my contour brush didnt work for application i tried using multiple different smaller brushes but they wouldnt pick up the product at all the only way i could apply a decent amount at first was by using my finger once i covered my face and blended the coverage was so light it was like i hadnt applied any at all i put another application of the highlight and contour and could still barely see a difference ill try other brushes to see if i have more success and will update my review accordinglyupdate when applied in conjunction with the rest of my makeup it created a very smooth natural look and was quite light and comfortable i only wore it for a few hours but noticed my face was less greasy than when i use my usual makeup using a silicone sponge was the best way i found to apply the product",2023-06-12,3,"verified purchase"
"764","conceal-correct-contour-palette-3cp01","great value","andrea","loved this it is hard to get all of it out to use up once get to bottom",2023-08-16,3,"verified purchase"
"765","conceal-correct-contour-palette-3cp01","love it","tori sons"," would recommend to anyone",2023-12-26,4,"verified purchase"
"766","conceal-correct-contour-palette-3cp01","project is not as moist as i was hoping","delores","its a little hard to apply because of the packaging its hard to get your brush in one particular square not as creamy as i hoped not as blend as i as i wished it is still a nice portable option",2023-10-16,5,"verified purchase"
"767","conceal-correct-contour-palette-3cp01","used to be more creamy","kiesha neil","this is for light skin tones i have lightmed and i used to be able to blend two or more colors to make my shade but it doesnt seem like they used to make it i like it but not love it",2023-06-20,3,"verified purchase"
